"URL","NOMBRE","DESCRIPCION","EMPRESA","LUGAR DE TRABAJO","PUBLICADO","TIPO CONTRATO","AREA"
"https://www.zonajobs.com.ar/empleos/especialista-en-marketing-digital-aimg-1875336.html?indiceAviso=0","Especialista en Marketing Digital","Estamos buscando incorporar un Especialista de Marketing Digital para nuestra oficina de Florida Oeste.Profesional / estudiante de las carreras de Marketing / Publicidad para sumarse al equipo de Marketing y Comunicación. Principales responsabilidades:·        Planificar desarrollar e implementar calendarios de las distintas marcas en Redes Sociales;·        Pauta digital / contratación de medios + optimización de campañas.·        Dominio de Google Ads Facebok Ads.·        Seguimiento de las campañas en las diferentes plataformas;·        Detectar audiencias / segmentos estratégicos y diferenciales. (tipos demográficos comportamiento interés etc)·        Desarrollo seguimiento y control de Presupuesto Digital;·        Manejo y seguimiento de Influencers;·        Desarrollo de newsletters para campañas de e-mail marketing.·        Gestionar y administrar campañas de e-mail marketing con información de tráfico y rendimiento;·        Elaborar presentaciones y reportes de métricas / resultados y cumplimiento de objetivos·        Tareas de CM.  Requisitos:·        Formación en Marketing / Publicidad / Comunicación (Graduado o Estudiante Avanzado); Contar con cursos de marketing digital. Idealmente certificación Google.·        Experiencia: 3  años en posiciones similares;·        Manejo avanzado de redes sociales;·        Conocimientos en herramientas de E-mail Mkt (Doppler / Mailchimp); Plataforma Google digital (Analytics Adsense Ads Adwords; AdManager);  Hootsuite; Facebook Insigths; Business Facebook; DoubleClick etc.·        Muy buena redacción;·        Excel / PowerPoint intermedio - avanzado. Serán valorados perfiles pro-activos con autonomía y orientados a resultados.Indicar remuneración pretendida.

			El contenido de este aviso es de propiedad del anunciante. Los requisitos de la posición son definidos y administrados por el anunciante sin que Zonajobs sea responsable por ello.","AIMG","Florida Oeste Buenos Aires","Publicado hace 19 días","Full-time","Marketing"
"https://www.zonajobs.com.ar/empleos/community-manager-y-marketing-digital-1889284.html?indiceAviso=1","Community Manager y Marketing Digital","Importante grupo educativo seleccionara para su departamento de Comunicación: Community Manager y Marketing Digital Perfil:Experiencia profesional de al menos 5 años en manejo de redes socialesConocimientos de diseño graficoExperiencia en herramientas para la gestión de social media y analítica webPerfil metódico para seguir un plan de trabajo pero también con inquietudes para proponer ideas nuevasTener habilidades  para la producción de contenidos de promisión y publicidad en plataformas digitales.Haber elaborado campañas en redes sociales Requisitos:Egresado de carreras de MKT Comunicación o DiseñoDominio de herramientas Adobe (Ilustrator Premiere Photoshop)Google AdsExperiencia en plataformas del tipo Mailchimp para campañas de email marketing Residir en zona norte del GBA Ofrecemos:Incorporarte a un equipo profesional con alto foco en comunicación y el diseño en una red en permanente expansiónRelación de dependencia por 30hs semanalesMetodología articulada de trabajo presencial y home office ¡En caso de aplicar en la búsqueda envíanos tu cv y forma parte de nuestro Equipo de trabajo!

			El contenido de este aviso es de propiedad del anunciante. Los requisitos de la posición son definidos y administrados por el anunciante sin que Zonajobs sea responsable por ello.","Confidencial","Escobar Buenos Aires","Publicado hace 19 días","Part-time","Marketing"
"https://www.zonajobs.com.ar/empleos/diseno-grafico-marketing-digital-diseno-web-importante-desarrolladora-1889195.html?indiceAviso=2","DISEÑO GRAFICO / MARKETING DIGITAL / DISEÑO WEB","Posicion Diseñador Gráfico / Marketing Digital / Diseño web Requisitos:-Formación específica en diseño gráfico y digital.-Conocimientos avanzados de programas de: diseño gráfico (illustrator Photoshop  etc) diseño web (programación).-Experiencia en el desarrollo gestión e implementación de productos digitales y sólidos conocimientos en tendencias online.  -Deberá demostrar sólidas competencias en la generación de Estrategias de Marketing y Publicidad Digital (SEM SEO Social Media Management Ads Network Management e-commerce)-Excelente redacción y ortografía.-La persona tendrá que tener alta predisposición para trabajo en equipo.-Se valorará experiencia en empresas del rubro inmobiliario o afines. Principales Tareas:-Gestionar los productos digitales teniendo en consideración: avances y desarrollos técnicos; análisis y evaluación del mercado competencia y negocio.-Armado del plan de comunicación y marketing para cumplir con los objetivos comerciales previstos.-Diseño de contenido web y gráfico de distinto tipo catalogos folleteria etc. Por favor indicar pretensión salarial no se tendrán en cuenta aquellas postulaciones que no indiquen remuneración pretendida.

			El contenido de este aviso es de propiedad del anunciante. Los requisitos de la posición son definidos y administrados por el anunciante sin que Zonajobs sea responsable por ello.","Importante Desarrolladora","Martínez Buenos Aires","Publicado hace 24 días","Full-time","Diseño Gráfico"
"https://www.zonajobs.com.ar/empleos/semi-senior-en-marketing-digital-y-community-manager-zona-norte-martinez-lg-recursos-humanos-1889004.html?indiceAviso=3","SEMI SENIOR EN MARKETING DIGITAL Y COMMUNITY MANAGER  - Zona Norte Martínez","Empresa multinacional selecciona un SEMI SENIOR EN MARKETING DIGITAL Y COMMUNITY MANAGER quien tendrá a su cargo las siguientes tareas: • Gestión de Publicidad digital en: Facebook –Twitter –Instagram – Google –YouTube para subir contenidos de la marca y promociones vigentes•Uso de la plataforma Hootsuite• Interacción con prospectos de Redes Sociales• Vinculación de leads con el CRM TECNOM de la empresa • Administración de cuentas de M. Libre con publicidad de la Marca• Campañas por SMS y Mailing• Gestión de Publicidad en Google Adwords – Google Analytics –Google Mi Negocio• Gestión de contenidos publicitarios en la Web oficial de la Empresa• Diseño y desarrollo de placas publicitarias en formato editable para Redes Sociales / Web / Mails otros formatos.• Coordinar con personal interno / proveedores de publicidad digital externos las acciones y resultados de las campañas en publicidad digital  Se requiere: • Preferentemente con formación universitaria en carreras afines a  las tecnologías de la comunicación y manejo de CRM • Experiencia previa comprobable no inferior a 3 años• Muy buenas relaciones interpersonales apertura hacia las nuevas tecnologías en redes proactividad flexibilidad y alta disposición para interpretar las necesidades de las áreas comerciales a quienes dará soporte  Se ofrece: •Puesto efectivo y relación de dependencia• Horario: Lunes a viernes de  08:30hs a 17:30hs• Zona Norte: Martínez Indicar remuneración de dependencia 

			El contenido de este aviso es de propiedad del anunciante. Los requisitos de la posición son definidos y administrados por el anunciante sin que Zonajobs sea responsable por ello.","LG Recursos Humanos","San Isidro Buenos Aires","Publicado hace 31 días","Full-time","Marketing"
"https://www.zonajobs.com.ar/empleos/gerente-de-marketing-digital-nosis-1888944.html?indiceAviso=4","Gerente de Marketing Digital","Nosis Laboratorio de Investigación y Desarrollo S.A empresa líder en Informes Comerciales Online seleccionará un Gerente de Marketing. Será responsable de:Elaborar la estrategia de marketing (conjuntamente con otras gerencias) para todos los productos y servicios de la compañía.Implementar y controlar la ejecución del plan de marketing con foco en la satisfacción fidelización y retención de los clientes actuales y/o potenciales.Trabajar en equipo con el área de empleos en la elaboración y gestión de la imagen e identidad corporativa.Elaborar el plan de comunicación externa dirigido a múltiples audiencias y a través de múltiples canales/medios.Proponer planificar y desarrollar campañas en redes sociales implementando acciones y medir su eficacia.Implementar mejoras para optimizar el flujo de conversión del sitio web.Ejecutar las acciones necesarias para implementar las acciones de marketing en el ecosistema digital vinculando acciones con web content SEO etc.Medir y analizar el impacto de las acciones de marketing realizadas.Elaborar reportes de gestión del área análisis de mercado y competencia. Estamos en la búsqueda de profesionales graduados de carreras tales como Administración de Empresas Ingeniería Industrial Marketing Publicidad Comunicación o afines que tengan como mínimo 5 años de experiencia en el área de Marketing Digital preferentemente como Coordinador / Supervisor / Jefe / Gerente. Requisitos:Experiencia en presentación de estrategias y resultadosExperiencia en social mediaCapacidad de detectar oportunidades en el mercado onlineConocimientos en Google Analytics y otras herramientas de análisis y medición onlineManejo de KPls y experiencia en el desarrollo del Plan de Marketing Online.conocimientos en Google AdWords y Facebook Ads Skills Personales:Excelentes relaciones interpersonales.Excelentes habilidades de comunicación y de Planificación.Actitud pro-activa y flexibilidad a los cambios.AutomotivadoEstratégico / Resolutivo Lugar de trabajo: MicrocentroHorario: lunes a viernes de 9 hs a 18 hs  Si querés formar parte de una empresa innovadora dinámica orientada a resultados y en constante crecimiento ¡¡Sumate al Equipo de Nosis!!

			El contenido de este aviso es de propiedad del anunciante. Los requisitos de la posición son definidos y administrados por el anunciante sin que Zonajobs sea responsable por ello.","NOSIS","Capital Federal Buenos Aires","Publicado hace 33 días","Full-time","Marketing"
